[
	{
		"Production": "Lost Highway",
		"Company": "Aurora Fox Arts Center",
		"A1": "",
		"A2": "",
		"SD": "✘",
		"AD": "",
		"LZ": "",
		"Notes": "🛣️",
		"visible": false
	},
	{
		"Production": "Pete the Cat",
		"Company": "Arvada Center",
		"A1": "",
		"A2": "",
		"SD": "✘",
		"AD": "✘",
		"LZ": "",
		"Notes": "😸",
		"visible": false
	},
	{
		"Production": "Dear Evan Hansen",
		"Company": "Arvada Center",
		"A1": "✘",
		"A2": "",
		"SD": "",
		"AD": "✘",
		"LZ": "",
		"Notes": "📔",
		"visible": false
	},
	{
		"Production": "Misery",
		"Company": "Arvada Center",
		"A1": "✘",
		"A2": "",
		"SD": "",
		"AD": "✘",
		"LZ": "",
		"Notes": "🪓",
		"visible": true
	},
	{
		"Production": "Junie B. Jones",
		"Company": "Arvada Center",
		"A1": "✘",
		"A2": "",
		"SD": "✘",
		"AD": "✘",
		"LZ": "",
		"Notes": "🎀",
		"visible": true
	},
	{
		"Production": "Romeo & Juliet",
		"Company": "Arvada Center",
		"A1": "✘",
		"A2": "",
		"SD": "",
		"AD": "✘",
		"LZ": "",
		"Notes": "💔",
		"visible": false
	},
	{
		"Production": "Disney's Frozen",
		"Company": "Arvada Center",
		"A1": "✘",
		"A2": "",
		"SD": "",
		"AD": "✘",
		"LZ": "",
		"Notes": "❄️",
		"visible": true
	},
	{
		"Production": "The Mousetrap",
		"Company": "Arvada Center",
		"A1": "✘",
		"A2": "",
		"SD": "",
		"AD": "✘",
		"LZ": "",
		"Notes": "🪤",
		"visible": true
	},
	{
		"Production": "The Prom",
		"Company": "Arvada Center",
		"A1": "",
		"A2": "✘",
		"SD": "✘",
		"AD": "✘",
		"LZ": "",
		"Notes": "🪩",
		"visible": true
	},
	{
		"Production": "A Gentleman's Guide to Love and Murder",
		"Company": "Arvada Center",
		"A1": "✘",
		"A2": "",
		"SD": "",
		"AD": "✘",
		"LZ": "",
		"Notes": "🔪",
		"visible": true
	},
	{
		"Production": "Lyle the Crocodile",
		"Company": "Arvada Center",
		"A1": "✘",
		"A2": "",
		"SD": "",
		"AD": "✘",
		"LZ": "",
		"Notes": "🐊",
		"visible": true
	},
	{
		"Production": "A Christmas Carol",
		"Company": "Aurora Fox Arts Center",
		"A1": "✘",
		"A2": "",
		"SD": "✘",
		"AD": "",
		"LZ": "",
		"Notes": "🎄",
		"visible": true
	},
	{
		"Production": "The Lightning Thief",
		"Company": "Aurora Fox Arts Center",
		"A1": "✘",
		"A2": "",
		"SD": "✘",
		"AD": "",
		"LZ": "✘",
		"Notes": "⚡️",
		"visible": true
	},
	{
		"Production": "ART",
		"Company": "Aurora Fox Arts Center",
		"A1": "",
		"A2": "",
		"SD": "✘",
		"AD": "",
		"LZ": "",
		"Notes": "🖼️",
		"visible": true
	},
	{
		"Production": "Treasure Island",
		"Company": "Aurora Fox Arts Center",
		"A1": "✘",
		"A2": "",
		"SD": "",
		"AD": "",
		"LZ": "",
		"Notes": "🏴‍☠️",
		"visible": true
	},
	{
		"Production": "Blues in the Night",
		"Company": "Aurora Fox Arts Center",
		"A1": "✘",
		"A2": "",
		"SD": "✘",
		"AD": "",
		"LZ": "",
		"Notes": "📻",
		"visible": true
	},
	{
		"Production": "The Last Session",
		"Company": "Town Hall Arts Center",
		"A1": "✘",
		"A2": "",
		"SD": "",
		"AD": "",
		"LZ": "",
		"Notes": "🎙️",
		"visible": true
	},
	{
		"Production": "Jedi Handbook",
		"Company": "Aurora Fox Arts Center",
		"A1": "✘",
		"A2": "",
		"SD": "",
		"AD": "",
		"LZ": "✘",
		"Notes": "📖",
		"visible": true
	},
	{
		"Production": "Disney's Freaky Friday",
		"Company": "Aurora Fox Arts Center",
		"A1": "✘",
		"A2": "",
		"SD": "",
		"AD": "",
		"LZ": "",
		"Notes": "⏳",
		"visible": true
	},
	{
		"Production": "Hurricane Diane",
		"Company": "Aurora Fox Arts Center",
		"A1": "✘",
		"A2": "",
		"SD": "✘",
		"AD": "",
		"LZ": "",
		"Notes": "🌀",
		"visible": true
	},
	{
		"Production": "A Very Merry Unauthorized Children's Scientology Pageant",
		"Company": "Aurora Fox Arts Center",
		"A1": "✘",
		"A2": "",
		"SD": "",
		"AD": "",
		"LZ": "",
		"Notes": "🛸",
		"visible": false
	}
]
